,publication_number,patent_title,appl_type,negative_text
129,US10204615B2,Noise-cancelling headphone,utility,"['<p id=""p-0011"" num=""0010"">For the FF noise-cancelling headphone disclosed in Japanese Unexamined Patent Application No. 2010-109799, the noise reaching the headphone changes direction in the interior of the groove and is then collected by the microphone. Thus, the prediction of the variation in the noise described above requires highly sophisticated calculation. This requirement may hinder the FF noise-cancelling headphone disclosed in Japanese Unexamined Patent Application No. 2010-109799 from exhibiting sufficient noise-cancelling effect. In addition, the microphone of the FF noise-cancelling headphone disclosed in Japanese Unexamined Patent Application No. 2010-109799 is disposed in the interior of the rear air chamber. The microphone may collect reproduced sounds output from the driver unit. When the microphone collects the reproduced sounds, the NC circuit generates cancelling signals corresponding to the reproduced sounds in addition to the cancelling signals corresponding to the external noises. As a result, the sound quality of the reproduced sound output from the driver unit may be degraded by the influence of the cancelling signals corresponding to the reproduced sounds in addition to the cancelling signals corresponding to the external noises.</p>', '<p id=""p-0012"" num=""0011"">As described above, noise-cancelling headphones, in particular, FF noise-cancelling headphones are required to avoid the influence of the wind and to prevent the degradation in the sound quality of the reproduced sound output from the driver unit.</p>', '<p id=""p-0013"" num=""0012"">An object of the present invention is to solve the problems described above, and to provide a noise-cancelling headphone that can avoid the influence of the wind and prevent the degradation in the sound quality of the reproduced sound output from the driver unit.</p>']"
130,US10204630B2,Method for generating filter for audio signal and parameterizing device therefor,utility,"['<p id=""p-0010"" num=""0008"">The present invention has an object, with regard to reproduce multi-channel or multi-object signals in stereo, to implement filtering process, which requires a high computational complexity, of binaural rendering for reserving immersive perception of original signals with very low complexity while minimizing the loss of sound quality.</p>', '<p id=""p-0011"" num=""0009"">Furthermore, the present invention has an object to minimize the spread of distortion by using high-quality filter when a distortion is contained in the input signal.</p>', '<p id=""p-0012"" num=""0010"">Furthermore, the present invention has an object to implement finite impulse response (FIR) filter which has a long length with a filter which has a shorter length.</p>', '<p id=""p-0013"" num=""0011"">Furthermore, the present invention has an object to minimize distortions of portions destructed by discarded filter coefficients, when performing the filtering by using truncated FIR filter.</p>']"
131,US10204632B2,"Audio/speech encoding apparatus and method, and audio/speech decoding apparatus and method",utility,"['<p id=""p-0008"" num=""0007"">However, in some applications, such as audio signal encoding, the signal statistics may vary significantly from one set of audio signal to another set of audio signal. And even within the same set of audio signal.</p>', '<p id=""p-0009"" num=""0008"">If the statistics of the audio signal varies drastically from the statistics of the predefined Huffman table, the encoding of the signal can not be optimally done. And it happens that, to encode the audio signal which has different statistics, the bits consumption by Huffman coding is much more than the bits consumption by fixed length coding.</p>', '<p id=""p-0010"" num=""0009"">One possible solution is to include both the Huffman coding and fixed length coding in the encoding, and the encoding method which consumes fewer bits are selected. One flag signal is transmitted to decoder side to indicate which coding method is selected in encoder. This solution is utilized in a newly standardized ITU-T speech codec G719.</p>', '<p id=""p-0011"" num=""0010"">The solution solves the problem for some very extreme sequences in which the Huffman coding consumes more bits than the fixed length coding. But for other input signals which have different statistics from the Huffman table but still select the Huffman coding, it is still not optimal.</p>', '<p id=""p-0012"" num=""0011"">In ITU-T standardized speech codec G719, Huffman coding is used in encoding of the norm factors\' quantization indices.</p>', '<p id=""p-0013"" num=""0012"">The structure of G719 is illustrated in <figref idref=""DRAWINGS"">FIG. 1</figref>.</p>', '<p id=""p-0014"" num=""0013"">At encoder side, the input signal sampled at 48 kHz is processed through a transient detector (<b>101</b>). Depending on the detection of a transient, a high frequency resolution or a low frequency resolution transform (<b>102</b>) is applied on the input signal frame. The obtained spectral coefficients are grouped into bands of unequal lengths. The norm of each band is estimated (<b>103</b>) and resulting spectral envelope consisting of the norms of all bands is quantized and encoded (<b>104</b>). The coefficients are then normalized by the quantized norms (<b>105</b>). The quantized norms are further adjusted (<b>106</b>) based on adaptive spectral weighting and used as input for bit allocation (<b>107</b>). The normalized spectral coefficients are lattice-vector quantized and encoded (<b>108</b>) based on the allocated bits for each frequency band. The level of the non-coded spectral coefficients is estimated, coded (<b>109</b>) and transmitted to the decoder. Huffman encoding is applied to quantization indices for both the coded spectral coefficients as well as the encoded norms.</p>', '<p id=""p-0015"" num=""0014"">At decoder side, the transient flag is first decoded which indicates the frame configuration, i.e., stationary or transient. The spectral envelope is decoded and the same, bit-exact, norm adjustments and bit-allocation algorithms are used at the decoder to recompute the bit-allocation which is essential for decoding quantization indices of the normalized transform coefficients. After de-quantization (<b>112</b>), low frequency non-coded spectral coefficients (allocated zero bits) are regenerated by using a spectral-fill codebook built from the received spectral coefficients (spectral coefficients with non-zero bit allocation) (<b>113</b>). Noise level adjustment index is used to adjust the level of the regenerated coefficients. High frequency non-coded spectral coefficients are regenerated using bandwidth extension. The decoded spectral coefficients and regenerated spectral coefficients are mixed and lead to normalized spectrum. The decoded spectral envelope is applied leading to the decoded full-band spectrum (<b>114</b>). Finally, the inverse transform (<b>115</b>) is applied to recover the time-domain decoded signal. This is performed by applying either the inverse modified discrete cosine transform for stationary modes, or the inverse of the higher temporal resolution transform for transient mode.</p>', '<p id=""p-0016"" num=""0015"">In encoder (<b>104</b>), the norm factors of the spectral sub bands are scalar quantized with a uniform logarithmic scalar quantizer with 40 steps of 3 dB. The codebook entries of the logarithmic quantizer are shown in <figref idref=""DRAWINGS"">FIG. 2</figref>. As seen in the codebook, the range of the norm factors is [2<sup>−2.5</sup>,2<sup>17</sup>], and the value decreases as the index increases.</p>', '<p id=""p-0017"" num=""0016"">The encoding of quantization indices for norm factors is illustrated in <figref idref=""DRAWINGS"">FIG. 3</figref>. There are in total 44 sub bands and correspondingly, 44 norm factors. For the first sub band, the norm factor is quantized using the first 32 codebook entries (<b>301</b>), while other norm factors are scalar quantized with the 40 codebook entries (<b>302</b>) shown in <figref idref=""DRAWINGS"">FIG. 2</figref>. The quantization index for the first sub band norm factor is directly encoded with 5 bits (<b>303</b>), while the indices for other sub bands are encoded by differential coding. The differential indices are derived using the formula as following (<b>304</b>):']"
132,US10204713B2,Emergency decision-making assistance system,utility,"['<p id=""p-0007"" num=""0011"">The above-described decision-making assistance system is intended for assisting a countermeasure for a natural disaster over a wide area, and is connected with a network to distribute various pieces of information to each terminal. Furthermore, since information selected from an extremely large existing database is presented, real-time information necessary for decision-making is not shared. Therefore, there is a risk that the determination of a specific countermeasure may be delayed, and there is also a risk that it may not be possible to respond to an unexpected situation such as information that is not in the database. Also, since each terminal shares the decision-making assistance system, there is a risk that the information distributed to each terminal may become extremely large, and it may become difficult to determine a countermeasure.</p>', '<p id=""p-0008"" num=""0012"">To solve the above-described problems, an object of the present invention is to provide an emergency decision-making assistance system that can effectively assist decision-making by obtaining only the up-to-date necessary information.</p>']"
133,US10204746B2,"Separation membrane for super capacitor, super capacitor comprising same, and manufacturing method therefor",utility,"['<p id=""p-0026"" num=""0025"">An objective of the present disclosure is to provide a super capacitor capable of reducing a thickness deviation for each position by disposing a roll force compensation member between a plate and an energy storage assembly and by preventing a center portion of the energy storage assembly from being convexly bent by a deviation of roll forces according to a position.</p>', '<p id=""p-0027"" num=""0026"">Another objective of the present disclosure is to provide a super capacitor capable of smoothly discharging bubbles generated when an electrolytic solution is impregnated through a gap by forming an active material layer serving as a positive electrode or a negative electrode as a divided structure and disposing the active material layer to have the gap.</p>', '<p id=""p-0028"" num=""0027"">Still another objective of the present disclosure is to provide a separation membrane for a super capacitor capable of improving impregnation of a fluid electrolyte solution by stacking a nanofiber web layer containing a polyacrylonitrile nanofiber on a nonwoven fabric layer, and a super capacitor including the same.</p>', '<p id=""p-0029"" num=""0028"">Yet another objective of the present disclosure is to provide a method of manufacturing a super capacitor in which an energy storage assembly in which a plurality of unit modules are sequentially stacked is formed as a plurality of partition assemblies in which a predetermined number of unit modules are stacked, a plurality of partition assemblies are then stacked again thereon to complete the energy storage assembly, and a roll force applied to a lowermost unit module may be reduced.</p>']"
134,US10204760B2,Charged particle beam apparatus,utility,"['<p id=""p-0013"" num=""0012"">However, according to the method of employing the image acquisition conditions corresponding to the size of the defect, which is disclosed in PTL 1, the result of the sample inspection using the defect inspection apparatus is inaccurate. Consequently, before the low magnification defect image is captured, it is not possible to determine in advance which image acquisition condition is to be employed. While the image acquisition conditions are sequentially switched over from a case having a large defect region toward a case having a small defect region, the low magnification defect image is repeatedly captured for the same defect candidate until the defect detection accuracy satisfies the completion determination condition. In addition, the defect inspection apparatus captures the low magnification defect image for detecting the defect, and concurrently, determines whether or not the defect detection accuracy satisfies the completion determination condition. However, during the repeated process, the defect inspection apparatus does not update a visual field center coordinate of the site appearing as the defect so as to reduce an imaging region around the updated coordinate. Consequently, the maximum time required for the imaging process of the low magnification defect image and the defect detection process is the same as that in the related art.</p>', '<p id=""p-0014"" num=""0013"">On the other hand, according to the method of employing two types of electron beam conditions in which the current values are different between the low magnification electron beam and the high magnification electron beam, which is disclosed in PTL 2, the method is effective in order to shorten the imaging time of the low magnification defect image by reducing the number of imaging frames (number of integrated image frames). In general, if a probe current increases approximately twice, even when the number of imaging frames decreases to approximately half of the number, it is known that the captured image having an equivalent or slightly smaller S/N ratio can be obtained. However, if a current value of the electron beam, that is, the probe current increases, resolution of the captured image becomes poor, thereby causing a possibility of poor accuracy in detecting a minor defect in the low magnification defect image. In addition, when the high magnification defect image is acquired, an electronic optical system condition of the probe current or the image acquisition condition has to be changed for imaging. Consequently, the method disclosed in PTL 2 does not considerably contribute to improved throughput of ADR.</p>', '<p id=""p-0015"" num=""0014"">The present invention is made in order to solve the above-described problems, and aims to provide a charged particle beam apparatus which can quickly perform high accuracy positioning and defect detection.</p>']"
135,US10204761B2,"Charged particle beam device, electron microscope and sample observation method",utility,"['<p id=""p-0010"" num=""0011"">In recent years, higher accuracy has been increasingly required for observation of frozen samples. In order to obtain accurate sample information by electron microscopic observation, it is necessary to evaluate whether or not a sample embedded in ice by the pre-process is appropriate for observation. In a case where the pre-process is not performed appropriately, a structure in the sample is exposed and damaged by an electron beam, and frost is generated on a surface of the ice, so that these may affect acquired images.</p>', '<p id=""p-0011"" num=""0012"">However, in the methods described in the above-mentioned PTL 1 and NPL 1, no consideration is given to evaluation of the sample itself after the pre-process. For this reason, according to the related technique, the evaluation is performed in a state in which frost attachment and presence or absence of exposure of the structure cannot be clearly determined.</p>', '<p id=""p-0012"" num=""0013"">An object of the present invention is to provide a charged particle beam device, an electron microscope, and a sample observation method which can stably observe a sample with high accuracy.</p>']"
136,US10204773B2,Ion guide and mass spectrometer using same,utility,"['<p id=""p-0007"" num=""0006"">In the ion guide described in PTL 1, since air current and the center of a pseudopotential of the ion guide are substantially coaxially incident to each other, there is a problem that the ion and the air current cannot be separated from each other.</p>', '<p id=""p-0008"" num=""0007"">In the ion guide of PTL 2, the pseudopotential barrier exists between axes of two ion guides. Therefore, in moving the ions from one ion guide to the other ion guide, it is necessary to apply a DC electric field which is sufficiently higher than the pseudopotential barrier. However, a kinetic energy of ions after climbing over the pseudopotential barrier when applying a high DC electric field increases, and ions are discharged to the outside of the ion guide. Therefore, there is a problem that a transmission efficiency of the ion guide is low. In addition, the method of PTL 2 can be employed in a high-order multipole ion guide or a ring stack type ion guide, but it is difficult to employ the method in a multipole having a low order, such as quadrupole. Therefore, when comparing with the multipole ion guide having a low order, such as the quadrupole ion guide, there is also a problem that performance of converging the ions is low.</p>', '<p id=""p-0009"" num=""0008"">In PTL 3, an operation under the condition that the air current exists is not described. In addition, in PTL 3, it is not described that the DC voltage which is different from that of another rod electrode is applied to a rod of a part of the rod electrode that configures the ion guide, and there is a problem that the ions are distributed in the vicinity of a minimum point of the pseudopotential.</p>', '<p id=""p-0010"" num=""0009"">The present invention realizes an ion guide which can separate air current and ions from each other, and which has high ion transmission efficiency.</p>']"
137,US10204824B2,Method for producing SOI wafer,utility,"['<p id=""p-0014"" num=""0013"">As described in Patent Document 3, it is known that particles such as silicon thin pieces adhere to a terrace portion of a bonded wafer just after delamination.</p>', '<p id=""p-0015"" num=""0014"">As a result of the study conducted by the inventors of the present invention, it has been revealed that, if flattening heat treatment is performed in an atmosphere containing argon gas, with such silicon thin pieces being present on an oxide film in a terrace portion of a SOI wafer with a silicon oxide film in a terrace portion, the silicon thin pieces and the oxide film react and, based on a reaction formula: Si+SiO<sub>2</sub>→2SiO (gas), the silicon oxide film in the terrace portion is greatly etched around the silicon thin pieces and depressions are formed. If a device production process is performed in a state in which such depressions are formed in the terrace portion, a photoresist tends to remain in the depressions, which becomes a generation source of contamination or particles.</p>', '<p id=""p-0016"" num=""0015"">The present invention has been made in view of the problems and an object thereof is to provide a method for producing a SOI wafer, the method that can flatten a delaminating plane without formation of unnecessary depressions in a terrace portion when flattening heat treatment is performed on a delaminating plane of a SOI wafer having a silicon oxide film in a terrace portion in an atmosphere containing argon gas, the SOI wafer fabricated by performing delamination heat treatment by an ion implantation delamination method.</p>']"
138,US10204854B2,Packaging substrate and method of fabricating the same,utility,"['<p id=""p-0009"" num=""0008"">The present invention aims to provide a packaging substrate that better improves or prevents breakage of a cut surface of a core substrate due to temperature change during or after fabricating the packaging substrate by dicing a wiring substrate into pieces, the wring substrate being formed by laminating an insulating layer and wiring layers on the core substrate, and a method of fabricating the same.</p>']"
139,US10204872B2,Power module and power conversion apparatus having a warpage suppression portion,utility,"['<p id=""p-0006"" num=""0005"">The sealed structure of a conventional power module is a structure in which only a surface equipped with a switching element is resin-sealed and the back surface, which is a heat dissipation layer, is exposed. Therefore, it is known that no little warpage generally occurs in the power module due to cure shrinkage through resin curing during manufacturing, resin shrinkage during cooling, expansion and shrinkage at environment temperatures in practical use, or the like. When warpage that exceeds a permissible range occurs in the power module, a distance between the power module and an attachment body (heat sink) on which the power module is attached is increased and interferes with thermal contact, so that the heat generated in the semiconductor element cannot be diffused effectively.</p>', '<p id=""p-0007"" num=""0006"">It is an object of the present invention to provide a power module capable of maintaining the reliability and the manufacturability, and securing a heat dissipation route, and a power conversion apparatus.</p>']"
140,US10204886B2,Semiconductor device,utility,"['<p id=""p-0006"" num=""0005"">The external electrode, which is an electrode exposed to the outside of the semiconductor device, is often formed by punching a single metal plate with a die or the like. When such an external electrode is soldered to a semiconductor chip, various troubles occur. For example, plural external electrodes joined to the semiconductor chip constitute a two-dimensional wiring, so that the degree of freedom of wiring decreases and the outer size of the semiconductor chip increases.</p>', '<p id=""p-0007"" num=""0006"">Furthermore, when the plural external electrodes are soldered to the semiconductor chip at the same time, it is difficult to make the plural external electrodes even in height. When the plural external electrodes are uneven in height, the solder thickness becomes irregular, so that a large margin must be set for the solder thickness.</p>', '<p id=""p-0008"" num=""0007"">Furthermore, when the same electrode is applied to an external electrode connected to a signal circuit portion through which a small current flows, and an external electrode connected to a main circuit portion through which a large current flows, the external electrode connected to the signal circuit portion is over-engineered from the viewpoint of current capacity. In this case, a useless cost occurs in addition to an increase in the outer size of the semiconductor device.</p>', '<p id=""p-0009"" num=""0008"">Furthermore, in order to secure some degree of strength, the external electrode is formed to be relatively thick. It is not easy to solder such an external electrode to a narrow area site such as a signal pad of the semiconductor chip with high precision. Therefore, there is a problem that the size of the semiconductor chip must be set to be large in order to increase the area of the signal pad.</p>', '<p id=""p-0010"" num=""0009"">Furthermore, stress acting on the external electrode when a case is deformed or solder is joined directly acts on solder in contact with the semiconductor chip. It is necessary to shorten the length of the external electrode so that large force does not act on the solder.</p>', '<p id=""p-0011"" num=""0010"">The present invention has been made to solve the foregoing problem, and has an object to provide a semiconductor device capable of preventing troubles occurring due to soldering of an external electrode to a semiconductor chip.</p>']"
141,US10204973B2,Display device and thin-film transistors substrate,utility,"['<p id=""p-0008"" num=""0007"">There is the problem with the above conventional channel protection type thin-film transistors that the on-state resistance cannot be reduced sufficiently.</p>', '<p id=""p-0009"" num=""0008"">In order to reduce the on-state resistance, for example, the channel length of the semiconductor layer of the thin-film transistor may be reduced. The channel length depends on the distance between a contact region for contact with the source electrode and a contact region for contact with the drain electrode. Thus, the distance between the contact region for contact with the source electrode and the contact region for contact with the drain electrode may be reduced in order to reduce the channel length.</p>', '<p id=""p-0010"" num=""0009"">However, the source electrode and the drain electrode have to be physically isolated from each other. Thus, there is a limit to reducing the distance between the contact region for contact with the source electrode and the contact region for contact with the drain electrode in the above conventional channel protection type thin-film transistors.</p>', '<p id=""p-0011"" num=""0010"">In view of this, the present disclosure provides a display device that includes a thin-film transistor having a reduced on-state resistance, and a thin-film transistor substrate.</p>']"
142,US10205052B2,"Semiconductor stacking structure, and method and apparatus for separating nitride semiconductor layer using same",utility,"['<p id=""p-0010"" num=""0009"">The problem to be solved by the present disclosure is to provide a semiconductor stacking structure that forms a high quality nitride semiconductor layer with reduced stress applied to the nitride semiconductor layer when growing the nitride semiconductor layer and is easy to separate the nitride semiconductor layer from a substrate with no need for laser lift-off, and a method and apparatus for separating a nitride semiconductor layer using the same.</p>']"
143,US10205060B2,Semiconductor light emitting device,utility,"['<p id=""p-0011"" num=""0010"">The problems to be solved by the present disclosure will be described in the latter part of the best mode for carrying out the invention.</p>']"
