,publication_number,patent_title,appl_type,negative_text
63,US10202667B2,High strength hot rolled steel sheet and method for manufacturing the same,utility,"['<p id=""p-0016"" num=""0015"">However, as for the technology proposed in Patent Literature 1, a high proportion of V which degrades the stability of carbides is contained and, in addition, the thermal stability of carbides is not considered. Consequently, in production of the hot rolled steel sheet, there are problems that after coiling, the carbides are coarsened in the central portion in the sheet width direction, where the cooling rate is small, the strength is reduced easily, and variations in the strength occur easily. Meanwhile, as for the stability of mechanical properties, Patent Literature 1 mentions that the end portion in the coil width direction comes into a supercooled state in the coiling step of the hot rolled steel sheet production and, thereby, fine carbides tend to be precipitated insufficiently in the end portion in the sheet width direction. However, in the technology proposed in Patent Literature 1, precipitation behavior of the carbides and coarsening are not considered sufficiently and, therefore, there is a problem that the susceptibility of the strength uniformity to the coiling temperature becomes high.</p>', '<p id=""p-0017"" num=""0016"">In the technology proposed in Patent Literature 2, as is shown by the example thereof, the Si content of a steel sheet having yield strength of 740 MPa (75.5 kgf/mm<sup>2</sup>) or more is more than 0.5% and it is difficult for the steel sheet having such a high Si content to obtain good surface quality. Also, the technology proposed in Patent Literature 2 aims at enhancing strength of the steel sheet through precipitation strengthening by TiC, although the thermal stability and the precipitation behavior of the carbides are not considered. Consequently, it is difficult for the technology described in Patent Literature 2 to produce a hot rolled steel sheet exhibiting good strength uniformity.</p>', '<p id=""p-0018"" num=""0017"">As for the technology proposed in Patent Literature 3, the steel sheet exhibiting excellent strength uniformity in the coil longitudinal direction is obtained. However, no information on the strength uniformity in the sheet width direction is shown. In addition, in the technology proposed in Patent Literature 3 as well, the relationship between the precipitation behavior of the precipitates contributing to enhancement of strength of the steel sheet and coarsening are not considered, so that it is difficult to stabilize the strength of the end portion in the sheet width direction and the strength in the central portion. Meanwhile, a steel sheet having yield strength YS of 740 MPa or more is not obtained by the technology proposed in Patent Literature 3.</p>', '<p id=""p-0019"" num=""0018"">In the technology proposed in Patent Literature 4, enhancement of the strength of the hot rolled steel sheet is aimed by specifying the matrix to be a substantially ferrite microstructure and finely dispersing carbides containing Ti and Mo into the ferrite microstructure. However, Mo has a function of interfering proceeding of austenite/ferrite transformation. Consequently, in the case where a hot rolled steel sheet is produced by using a steel in which Mo is an indispensable addition element, as in the technology proposed in Patent Literature 4, austenite/ferrite transformation does not proceed sufficiently in the end portion in the sheet width direction, where the cooling rate after coiling is large, and a low temperature transformation phase, e.g., bainite transformation, is formed. As a result, in some cases, the microstructure and the strength stable across the coil surface (across the sheet surface) are not obtained by the technology proposed in Patent Literature 4.</p>', '<p id=""p-0020"" num=""0019"">As described above, it is difficult for the technologies in the related art to obtain good in-plane strength uniformity of the high strength steel sheet having yield strength of 740 MPa or more.</p>', '<p id=""p-0021"" num=""0020"">Disclosed embodiments have been made in consideration of such circumstances, and it is an object to provide a high strength hot rolled steel sheet having yield strength of 740 MPa or more and exhibiting excellent in-plane strength uniformity and a method for manufacturing the same.</p>']"
64,US10202676B2,Method for producing hot-dip Zn alloy-plated steel sheet,utility,"['<p id=""p-0008"" num=""0007"">In the invention disclosed by PTL 1, since it is necessary to cool the surface of the plating layer to a predetermined temperature before passing it through a water quenching zone, the production of hot-dip Zn alloy-plated steel sheets is restricted in some cases. For example, when producing a thick plated steel sheet, it is necessary to cool it to a predetermined temperature with a lowered feed rate of the plated steel sheet, which unavoidably lowers the productivity. Furthermore, when a readily oxidizable element is added to a plating bath, the readily oxidizable element easily forms a dross, and it is troublesome to control the concentration of the readily oxidizable element, which disadvantageously complicates the production process.</p>', '<p id=""p-0009"" num=""0008"">An object of the present invention is to provide a method for producing a hot-dip Zn alloy-plated steel sheet, which can easily suppress blackening of a surface of a plating layer without lowering the productivity and without performing complicated component control of a plating bath.</p>']"
65,US10202689B2,Laminate and gas barrier film,utility,"['<p id=""p-0034"" num=""0033"">The atomic layer deposition film formed by the method described in PTL 1 is easily scratched (pin holes may be caused as well) by external force. When the atomic layer deposition film is scratched by external force, the scratch may reach the substrate.</p>', '<p id=""p-0035"" num=""0034"">When such a scratch is made, gas can flow in and out between the atomic layer deposition film and the substrate through the scratch, in the atmosphere after film formation. As a result, the gas barrier properties are deteriorated, or the lamination strength between the substrate and the atomic layer deposition film is lowered.</p>', '<p id=""p-0036"" num=""0035"">As another problem, when fabricating a gas barrier film having a laminate including an atomic layer deposition film which is easily scratched in this way, the gas barrier properties of the gas barrier film will be deteriorated unless a fabrication line is designed such that a rigid object is prevented from contacting the atomic layer deposition film after being formed.</p>', '<p id=""p-0037"" num=""0036"">Therefore, in the processing steps of fabricating a gas barrier film from a laminate, taking up of the gas barrier film into a roll can deteriorate the gas barrier properties of the film. Thus, there has been a problem that a gas barrier film having a laminate including an atomic layer deposition film cannot be conveyed and stored in a rolled state.</p>', '<p id=""p-0038"" num=""0037"">The present invention has been made in light of the circumstances set forth above, and has an object of providing a laminate that can minimize deterioration in the gas barrier properties and the lamination strength between a substrate and an atomic layer deposition film formed on an outer surface of the substrate, and can minimize deterioration in the gas barrier properties if the laminate is conveyed and stored in a rolled state, by preventing the atomic layer deposition film from being easily scratched due to external force, and providing a gas barrier film having the laminate.</p>']"
66,US10202698B2,Device for manufacturing organic hydride,utility,"['<p id=""p-0008"" num=""0007"">In Patent Literature 1 that describes a conventional device for producing an organic hydride, a solid polymer electrolyte membrane is joined to not only a cathode catalyst but also an anode catalyst. Therefore, Patent Literature 1 has a problem in which an oxygen gas generated on the anode catalyst tends to remain.</p>', '<p id=""p-0009"" num=""0008"">The present invention has been made in view of such a problem, and an object of the present invention is to provide a technology capable of suppressing retention of an oxygen gas on an anode catalyst of a device for producing an organic hydride.</p>']"
67,US10202706B2,Silicon carbide single crystal wafer and method of manufacturing a silicon carbide single crystal ingot,utility,"['<p id=""p-0021"" num=""0034"">While the manufacturing methods that reduce the dislocation density of a wafer and similar methods have been practiced as described above, recent findings indicate that improving the device yield and forming a favorable epitaxial thin film on a wafer are not possible with a wafer that is simply low in dislocation density.</p>', '<p id=""p-0022"" num=""0035"">The present invention has been made in view of the problems described above, and an object of the present invention is to provide a SiC single crystal wafer that is low in dislocation density and small in elastic strain as well, and a method of manufacturing a silicon carbide single crystal ingot from which the SiC single crystal wafer can be obtained.</p>']"
68,US10202709B2,Method for manufacturing silicon carbide single crystal,utility,"['<p id=""p-0005"" num=""0004"">An object of the present disclosure is to provide a silicon carbide single crystal in which a different polytype is suppressed from being mixed.</p>']"
69,US10202741B2,Closed-circuit hydraulic system for construction machine,utility,"['<p id=""p-0017"" num=""0016"">The present disclosure is contrived to solve the problem and an object of the present disclosure is to provide a closed circuit hydraulic system for a construction machine which can easily implement a boosting function to increase thrust or torque of each actuator by using one variable relief valve in a construction machine constituted by the closed circuit hydraulic system.</p>']"
70,US10202765B2,Deck panel for construction,utility,"['<p id=""p-0012"" num=""0011"">The present disclosure has been made in an effort to solve the aforementioned problems, and an object of the present disclosure is to provide an environmentally-friendly deck panel for construction, in which a structure of the deck panel is improved and modularized, thereby reducing a period for construction of a reinforced concrete building, reducing construction costs, improving stability and construction quality, and minimizing construction wastes.</p>', '<p id=""p-0013"" num=""0012"">In addition, another object of the present disclosure is to provide a deck panel for construction which implements a deck panel structure in which the deck panels, which are disposed on a partitioned building, may be coupled, such that construction of a high-rise building may be simply and quickly performed.</p>']"
71,US10202882B2,Fault diagnosis device for exhaust pipe fuel injector,utility,"['<p id=""p-0007"" num=""0006"">However, in the exhaust pipe fuel injector, the nozzle hole is closed due to time-elapse deterioration so that an actual fuel injection amount is gradually reduced, and thus the fuel cannot be injected according to an instructed fuel injection amount. Therefore, there is needed a fault diagnosis device for an exhaust pipe fuel injector which diagnoses a normality or an abnormality of the exhaust pipe fuel injector.</p>', '<p id=""p-0008"" num=""0007"">In this regard, an object of the present invention is to provide a fault diagnosis device for an exhaust pipe fuel injector for diagnosing a normality or an abnormality of the exhaust pipe fuel injector.</p>']"
72,US10202895B2,"Control device of a vehicle, vehicle including control device, and control method of vehicle",utility,"['<p id=""p-0004"" num=""0003"">Japanese Patent Laying-Open No. 2000-234539 (PTD 1) does not specifically teach control of the engine in a normal mode. The engine usage status in the power generation mode differs from the engine usage status in the normal mode. After the control mode returns to the normal mode from the power generation mode, engine control suitable for vehicle running must be executed.</p>', '<p id=""p-0005"" num=""0004"">An object of the present invention is to provide the technique to appropriately control the operation of an internal combustion engine during vehicle running at a vehicle having the internal combustion engine used for power generation and vehicle running.</p>']"
73,US10202925B2,Internal combustion engine controller,utility,"['<p id=""p-0007"" num=""0006"">The present invention provides an internal combustion engine controller that carries out corrections with respect to a step-up switching stop operation and a step-up switching start operation of a step-up controller in consideration of the overshoot and undershoot due to delays of a step-up control circuit when a battery voltage and the characteristics of electronic parts mounted on a step-up circuit are changed, thereby carrying out accurate control to obtain step-up upper/lower-limit current threshold values set in advance.</p>']"
74,US10202932B2,Engine cooling structure,utility,"['<p id=""p-0006"" num=""0005"">However, in the engine cooling structure disclosed in Patent Document 1, since the cooling water in the water jacket flows along the outer side of the water jacket spacer, the heat of the cylinder liners is dissipated, via the cooling water, to the cylinder block outer peripheral wall that constitutes the outer periphery of the water jacket. Consequently, the cylinder liners are heated less effectively, and it takes time to make the temperature distribution of the entire cylinder liner substantially uniform. Therefore, sliding resistance of the pistons that slide inside the cylinder liner is not easily reduced, and the engine is less effectively warmed up. In addition, the upper portions of the cylinder liners that are near combustion chambers are cooled less effectively.</p>', '<p id=""p-0007"" num=""0006"">The technique disclosed herein has been developed in view of the foregoing, and some of the objects of the technique are to reduce heat dissipation to a cylinder block outer peripheral wall, to achieve fast and uniform heating of a cylinder liner, and to ensure cooling of an upper portion of the cylinder liner.</p>', '<p id=""h-0007"" num=""0000"">Solution to the Problem</p>', '<p id=""p-0008"" num=""0007"">To achieve the above objects, according to the technique disclosed herein, an upper section of a water jacket spacer is positioned close to a cylinder block outer peripheral wall, and a coolant passage is formed between the upper section of the water jacket spacer and an outer periphery of an upper portion of a cylinder liner.</p>', '<p id=""p-0009"" num=""0008"">Specifically, the technique disclosed herein relates to an engine cooling structure in which a water jacket surrounds a cylinder liner of a cylinder block forming part of an engine, a coolant-introducing section through which a coolant is introduced into the water jacket is formed in a cylinder block outer peripheral wall constituting an outer periphery of the water jacket, and a water jacket spacer is arranged in the water jacket. The technique also provides the following measures.</p>', '<p id=""p-0010"" num=""0009"">Specifically, according to the technique disclosed herein, the water jacket spacer is arranged to surround substantially an entire periphery of a portion of the cylinder liner which corresponds to the water jacket, an opening through which the coolant introduced from the coolant-introducing section is introduced to an inner side of the water jacket spacer is formed in a portion of the water jacket spacer which corresponds to the coolant-introducing section, an upper section of the water jacket spacer is positioned close to the cylinder block outer peripheral wall, a coolant passage through which the coolant introduced from the opening is circulated around an outer periphery of an upper portion of the cylinder liner is formed between the upper section of the water jacket spacer and the outer periphery of the upper portion of the cylinder liner, and a lower section of the water jacket spacer is positioned close to the cylinder liner.</p>', '<p id=""p-0011"" num=""0010"">With this configuration, since the coolant passage is formed between the upper section of the water jacket spacer and the outer periphery of the upper portion of the cylinder liner, the coolant flowing through the coolant passage is not allowed to come into contact with the cylinder block outer peripheral wall. Further, since the upper section of the water jacket spacer is positioned close to the cylinder block outer peripheral wall, the coolant flowing through the coolant passage is thermally insulated by the water jacket spacer. These features may hinder the heat of the cylinder liner from dissipated to the cylinder block outer peripheral wall via the coolant flowing through the coolant passage. In addition, the lower section of the water jacket spacer is positioned close to a lower portion of the cylinder liner, and the lower portion of the cylinder liner is thermally insulated by the water jacket spacer, which may hinder the lower portion of the cylinder liner from being cooled. Thus, the cylinder liner may be heated within a short time, and uniform temperature distribution may be achieved. As a result, the sliding resistance of pistons may be reduced, and fuel efficiency may be improved. Furthermore, the upper portion of the cylinder liner may be reliably cooled. Moreover, since the coolant flows only through substantially the upper portion of the water jacket, the amount of the coolant may be reduced, and load on a water pump which sends the coolant to the water jacket may be reduced. As a result, the warm-up of the engine may be facilitated.</p>', '<p id=""p-0012"" num=""0011"">The coolant passage is beneficially formed by spacing the upper section of the water jacket spacer from the outer periphery of the upper portion of the cylinder liner.</p>', '<p id=""p-0013"" num=""0012"">With this configuration, since the coolant passage is formed by spacing the upper section of the water jacket from the outer periphery of the upper portion of the cylinder liner, the coolant passage may be formed without changing the shape of the outer periphery of the upper portion of the cylinder liner.</p>', '<p id=""p-0014"" num=""0013"">It is beneficial that: the engine be configured as a multi-cylinder engine including a plurality of cylinders; the cylinder liner comprise a plurality of cylinder liners; the water jacket surround the cylinders each provided in an associated one of the cylinders; the water jacket spacer be made of resin and surround the cylinder liners; and seal members be provided between inter-cylinder bore walls of the cylinder block and portions of the water jacket spacer which correspond to the inter-cylinder bore walls.</p>', '<p id=""p-0015"" num=""0014"">With this configuration, while the water jacket spacer of resin is molded, taking into consideration manufacturing errors and mountability, such that large gaps are provided between the spacer and the inter-cylinder bore walls, the seal members are provided in these gaps. This may hinder the coolant flowing through the coolant passage from leaking outside from the coolant passage via the gaps.</p>', '<p id=""p-0016"" num=""0015"">The opening is beneficially formed in an end portion of the water jacket spacer in a direction in which the cylinders are aligned; and the coolant passage is beneficially formed such that the coolant introduced from the opening is circulated from an exhaust side portion of the coolant passage to an intake side portion of the coolant passage.</p>', '<p id=""p-0017"" num=""0016"">With this configuration, since the coolant is circulated from the exhaust side portion having a relatively high temperature, the cylinder liner of each cylinder may be appropriately cooled.</p>', '<p id=""p-0018"" num=""0017"">In a cylinder head which constitutes the engine together with the cylinder block, a cylinder head water jacket through which the coolant from the water jacket of the cylinder block flows is beneficially formed. A coolant-discharging section through which the coolant that has been circulated through the coolant passage is discharged to the cylinder head water jacket is beneficially formed in an end portion of the water jacket spacer in the direction in which the cylinders are aligned. A coolant-restricting section which restricts a flow of the coolant that has been introduced from the opening is beneficially formed between the coolant-discharging section and the opening in the water jacket spacer.</p>', '<p id=""p-0019"" num=""0018"">With this configuration, the coolant that has been introduced from the coolant-introducing section enters the coolant passage through the opening, and flows to the exhaust side portion and the intake side portion of the coolant passage. The portion of the coolant flowing to the intake side portion is restricted by the coolant-restricting section. Specifically, the coolant that flows from the opening to the cylinder head water jacket through the coolant-discharging section is restricted by the coolant-restricting section. Therefore, the major portion of the coolant that has flowed through the opening into the coolant passage may be made to flow through the exhaust side portion of the coolant passage and may be reliably circulated through the coolant passage. Then, the coolant may be reliably made to flow into the cylinder head water jacket.</p>', '<p id=""h-0008"" num=""0000"">Advantages of the Invention</p>', '<p id=""p-0020"" num=""0019"">According to the technique disclosed therein, heat dissipation to the cylinder block outer peripheral wall may be reduced, fast and uniform heating of the cylinder liner may be achieved, and the upper portion of the cylinder liner may be reliably cooled.</p>']"
