,publication_number,patent_title,appl_type,negative_text
101,US10203469B2,Auto focus locking unit and photographing apparatus including the same,utility,"['<p id=""p-0005"" num=""0004"">One or more embodiments of the present invention include an auto focus (AF) locking unit supporting a lens group barrel holder in an optical axis direction by using a rotation of a cam barrel, and a photographing apparatus including the AF locking unit.</p>', '<p id=""p-0006"" num=""0005"">One or more embodiments of the present invention includes an AF locking unit supporting a lens group barrel holder that is descends by rotation of a cam barrel in an optical axis direction by using a locking lever that is provided with an elastic force, and a photographing apparatus including the AF locking unit.</p>', '<p id=""p-0007"" num=""0006"">One or more embodiments of the present invention includes an AF locking unit supporting a lens group barrel holder that descends corresponding to rotation of a cam barrel in an optical axis direction by using a locking lever contacting a fixing protrusion, and a photographing apparatus including the AF locking unit.</p>', '<p id=""p-0008"" num=""0007"">One or more embodiments of the present invention includes an AF locking unit supporting a semi-circular protrusion of a lens group barrel holder descending in correspondence to rotation of a cam barrel in an optical axis direction by using a locking lever protrusion contacting a fixed protrusion and a locking plate separated from the locking lever protrusion, and a photographing apparatus including the AF locking unit.</p>', '<p id=""p-0009"" num=""0008"">One or more embodiments of the present invention includes an AF locking unit supporting a lens group barrel holder in an optical axis direction by using a locking plate contacting a part of a semi-circular protrusion of the lens group barrel holder that is descended, and a photographing apparatus including the AF locking unit.</p>', '<p id=""p-0010"" num=""0009"">One or more embodiments of the present invention includes an AF locking unit, in which a locking lever elastic member provides a locking lever with maximum elastic force when a lens group barrel holder reaches an accommodation location, and a photographing apparatus including the AF locking unit.</p>', '<p id=""p-0011"" num=""0010"">One or more embodiments of the present invention includes an AF locking unit, in which a distance between a front surface of a lens group barrel holder and an inner side surface of a ball guide is reduced less than that of a case where the lens group barrel holder reaches a protruding location in correspondence to a compressive transformation length of a locking lever elastic member when the lens group barrel holder reaches an accommodation location, and a photographing apparatus including the AF locking unit.</p>', '<p id=""p-0012"" num=""0011"">One or more embodiments of the present invention includes an AF locking unit supporting a lens group barrel holder in an optical axis direction, and a photographing apparatus including the AF locking unit.</p>', '<p id=""p-0013"" num=""0012"">Additional aspects will be set forth in part in the description which follows and, in part, will be apparent from the description, or may be learned by practice of the presented embodiments.</p>']"
102,US10203520B2,Progressive power lens group,utility,"['<p id=""p-0007"" num=""0006"">In the progressive power lens, there are many cases in which the power change state at the intermediate region is different. Then, the lens optimal for the wearer is very different. In addition, even when the lens optimal for the wearer is manufactured, a position on the lens when the wearer sees a computer changes from the previous lens if the wearer replaces the previous lens by a new lens.</p>', '<p id=""p-0008"" num=""0007"">Besides, as an example in which the power change state at the intermediate region is different, there is a variation in the power which is intentionally added to the distance region without changing the near power in the method described in Patent Literature 1.</p>', '<p id=""p-0009"" num=""0008"">In the above-described cases, since a position on the lens for seeing an intermediate distance optimal for the wearer changes even at the same near power, the wearer needs to make an effort of taking an unnecessary body motion such that a face direction is changed or a body is inclined forward and backward in order to allow a line of sight to pass through a part having a power suitable for the intermediate distance. That is, since there is a different design variation or a replacement of the lens, a comfortable posture is not guaranteed.</p>', '<p id=""p-0010"" num=""0009"">An object of the invention is to provide a progressive power lens group which gives a comfortable posture to an individual when a different lens in the same lens group is selected.</p>']"
103,US10203523B2,Progressive power lens,utility,"['<p id=""p-0008"" num=""0007"">However, in the progressive power lens having the both-sides composite progressive structure, since the power change in the vertical direction of the lens and the power change in the horizontal direction of the lens are divided and distributed to the front and the rear surfaces of the lens respectively, when a desired addition power is obtained while keeping the meniscus shape, a surface refractive power (namely, a depth of a lens curve) in the vertical direction of the lens of the object side surface is in a tendency to be larger. Especially, in a lens having a positive power, since the lens curve of the eyeball side surface becomes thin as a whole, in order to keep the meniscus shape including a near portion, it is necessary to ensure the depth of the lens curve of the object side surface to some extent. Accordingly, in the progressive power lens having the both-sides composite progressive structure, the lens carve of the eyeball side surface becomes deeper, and therefore a thickness of the lens for glasses becomes thicker compared to a progressive power lens having a surface configuration in which a progressive surface is arranged on at least one of the front and the rear surfaces of the lens. Thus, the progressive power lens having the both-sides composite progressive structure has a unique problem in which outer appearance, performance in fashion or the like as the lens for glasses is deteriorated.</p>', '<p id=""p-0009"" num=""0008"">Thus, an object of the present invention is to provide a progressive power lens having a both-sides composite progressive structure capable of suppressing a surface refractive purer (namely, a depth of a lens curve) to be large and capable of achieving thinning of a thickness of the lens.</p>']"
104,US10203539B2,Liquid crystal device,utility,"['<p id=""p-0007"" num=""0006"">The present invention is directed to providing a liquid crystal device, a method of manufacturing the liquid crystal device, and the use of the liquid crystal device.</p>']"
105,US10203558B2,Liquid crystal display device,utility,"['<p id=""p-0009"" num=""0008"">As described above, developments for applications such as smartphones and tablet PCs have recently been made so as to achieve liquid crystal panels having narrower frames and backlights having higher luminances, but these developments have resulted in an increased likelihood of stains (unevenness) at the edges of liquid crystal panel screens and the edges of box pattern displays. The defects at the edges of box pattern displays will be detected as burn-in.</p>', '<p id=""p-0010"" num=""0009"">The inventors have investigated the correlation between the above-described defects, such as burn-in and stains, and the reduction in seal part width for achieving liquid crystal panels having narrower frames. At the periphery of a liquid crystal panel, a seal part to be filled with a liquid crystal material is formed by stacking a TFT substrate and a color filter substrate on top of each other. The reduction in seal part width allows moisture, oxygen, and other impurities to readily permeate a liquid crystal layer from the outside of the liquid crystal panel. The inventors conducted tests to find that no defects occur when the liquid crystal panel is placed in a nitrogen atmosphere and that noticeable defects occur in an oxygen atmosphere, determining that the permeation of oxygen into the liquid crystal panel is a cause of the defects. That is to say, it is necessary to take measures to prevent oxidation in liquid crystal panels.</p>', '<p id=""p-0011"" num=""0010"">When a liquid crystal panel is manufactured by a liquid crystal one-drop fill process, a photocurable sealing material is applied to either of the substrates by drawing with a dispenser, and a liquid crystal material is dropped onto either of the substrates, after which the substrates are stacked on top of each other and then irradiated with UV light or visible light to cure the sealing material. The light to be applied is selected according to the main reactive wavelength of a photopolymerization initiator in the sealing material. However, at the periphery, it is necessary to provide space for disposing light-shielding members such as wires, and when the width of the seal part is narrow, sufficient space not overlapping the light-shielding members cannot be provided. In the light-shielding region overlapping the light-shielding members, the sealing material is not irradiated with sufficient light, thus leading to insufficient curing of the sealing material, and as a result, components, mainly, low-molecular components in the sealing material are likely to flow out into the liquid crystal material in the liquid crystal layer. The sealing material typically contains a photopolymerization initiator in addition to a major proportion of epoxy materials and acrylic materials, and if the highly reactive photopolymerization initiator flows out into the liquid crystal material, and light from a backlight having enhanced luminance is applied, defects are highly likely to occur. However, to achieve a liquid crystal panel having a narrower frame, it is necessary to reduce the seal part width while maintaining an overlapping area of the light-shielding region and the seal part, and thus it has been difficult to reduce the amount of outflow into the liquid crystal layer.</p>', '<p id=""p-0012"" num=""0011"">These various investigations have suggested that photopolymerization initiators cause burn-in and stains according to the following flow.</p>', '<p id=""h-0007"" num=""0000"">(1) Radical Generation</p>', '<p id=""p-0013"" num=""0012"">Upon irradiation of a liquid crystal panel with light (amount of energy: hν) from a backlight, an unreacted photopolymerization initiator, which has not reacted during a photocuring treatment of a sealing material, is excited to generate radicals, as expressed by the following formula (A-I). In particular, radicals are generated significantly when a backlight having enhanced luminance is used.</p>', '<p id=""p-0014"" num=""0013""><chemistry id=""CHEM-US-00001"" num=""00001"">']"
106,US10203594B2,Projector,utility,"['<p id=""p-0006"" num=""0007"">However, in the above-described projection device, the operation icon is sometimes shaded by the hand during operation, which may render operation difficult.</p>', '<p id=""p-0007"" num=""0008"">It is an object of the present invention to provide a projector in which the operation icon is easy to be seen, and which can be favorably operated.</p>']"
107,US10203597B2,Structure-manufacturing method using step-and-repeat imprinting technique,utility,"['<p id=""p-0007"" num=""0006"">In such step and repeat imprint technique, in a state where a small mold having a fine pattern is pressed against a resin layer of a large area, a procedure of curing the resin layer in an area pressed against the mold is repeated while changing the mold position to obtain a fine pattern of a large area. Since a good fine pattern is not obtained when the resin layer in a region not pressed against the mold is cured, curing of the resin layer in the region not pressed against the mold is suppressed in PTL 1 by increasing the oxygen concentration in the atmosphere.</p>', '<p id=""p-0008"" num=""0007"">Differently from PTL 1, the present inventor attempted to prevent curing of a resin layer in a region not pressed against a mold by pressing a mold against a part of a resin layer composed of a photo curable resin composition containing a photo initiator, and in a state of covering the resin layer in the region surrounding the mold with a shading mask, radiating curing light. However, as a result of an actual attempt at this method, due to the influence of stray light and the like, a phenomenon occurred that the resin layer was cured with a width of 1.5 mm or more even in the area covered with the shading mask. Hereinafter, such phenomenon is referred to as “in-mask curing corrosion”.</p>', '<p id=""p-0009"" num=""0008"">In such state, the present inventor attempted to suppress in-mask curing corrosion by reducing the amount of curing light radiation or decreasing the amount of added photo initiator. As a result of employing these mechanisms, the in-mask curing corrosion was suppressed, whereas curing of the resin layer in the area where the mold was instead pressed against for the fine pattern was insufficient and a new problem arose that the shape stability of the fine pattern to be transferred to the resin layer reduced.</p>', '<p id=""p-0010"" num=""0009"">The present invention has been made in view of such circumstances and is to provide a method of manufacturing a structure that is capable of suppressing the in-mask curing corrosion while minimizing influence on shape stability of a fine pattern to be transferred to a resin layer.</p>']"
108,US10203601B2,"Tetracarboxylic acid diester compound, polymer of polyimide precursor and method for producing same, negative photosensitive resin composition, patterning process, and method for forming cured film",utility,"['<p id=""p-0017"" num=""0014"">The present invention has been done in view of the circumstance, and an object thereof is to provide a tetracarboxylic acid diester compound which can be led to a polymer of a polyimide precursor that can be used as a base resin of a negative photosensitive resin composition which can form a fine pattern and can obtain high resolution, a polymer of a polyimide precursor obtained by using the tetracarboxylic acid diester compound and a method for producing the same.</p>', '<p id=""p-0018"" num=""0015"">In addition, the other objects are to provide a negative photosensitive resin composition using a polymer of a polyimide precursor as a base resin which can accomplish improvement in resolution due to large difference in dissolution rates between an unexposed portion (a portion dissolving in the developer) and an exposed portion (the portion which becomes insoluble in the developer by the crosslinking reaction, photopolymerization, etc.) of the negative pattern obtained by high solubility in the developer of an organic solvent in the patterning, i.e., high contrast in dissolution, without impairing the pattern profile by generating swelling, etc., when the development by an organic solvent is carried out, and to provide a negative photosensitive resin composition which can make an organic solvent when the development by an organic solvent is carried out a versatile and safety organic solvent.</p>']"
109,US10203616B2,"Electrophotographic photoreceptor, electrophotographic photoreceptor cartridge, and image forming apparatus",utility,"['<p id=""p-0010"" num=""0009"">However, particularly, in high-end models with long service life and high speed, as the load applied to the photoreceptor is large, dependency with respect to the photoreceptor in the abrasion resistance and the electrical properties after abrasion becomes larger, and thus the photoreceptor having higher level of the electrical properties and the abrasion resistance has been required. In other words, an object of the present invention is to provide an electrophotographic photoreceptor having remarkably excellent abrasion resistance while maintaining the residual potential, a cartridge using the electrophotographic photoreceptor, and an image forming apparatus.</p>']"
110,US10203647B2,"Bearing member, end member, photoreceptor drum unit, developing roller unit, process cartridge, and manufacturing method of bearing member",utility,"['<p id=""p-0015"" num=""0016"">However, with the inventions described in PTL 1 and in NPL 1, it is difficult to realize smooth attachment of the shaft member to the bearing member, smooth swing of the shaft member, and smooth attachment and detachment of the shaft member to and from the apparatus main body. In association with this, high accuracy is required for each member to achieve necessary functions, and there is a large influence due to non-uniformity in quality of the shaft member.</p>', '<p id=""p-0016"" num=""0017"">In addition, the coupling member (shaft member) and the drum flange (bearing member) which holds the coupling member described in PTL 1 are configured such that the spherical portion is directly held by the drum flange and the coupling member (shaft member) can swing. Therefore, it is necessary to forcibly insert and forcibly remove the spherical portion with a strong force when attaching the spherical portion to the drum flange (bearing member). In addition, there is a concern that the shaft member may be damaged due to the forcible inserting and forcible removing with a strong force, workability is also not excellent, and there is an influence on reuse of the shaft member.</p>', '<p id=""p-0017"" num=""0018"">Meanwhile, in the structure described in NPL 1, there is also a case where the inclination angle of the shaft member when the shaft member swings is restricted, and a sufficient angle of swing is not achieved. Accordingly, there is a case where smooth attachment and detachment of the process cartridge is interfered with, and it becomes difficult to reduce the size of the image forming apparatus.</p>', '<p id=""p-0018"" num=""0019"">In addition, in the inventions described in NPL 2 and in PTL 2, the shaft member (the coupling member in NPL 2, the coupling in PTL 2) does not include one spherical portion unlike PTL 1 and NPL 1, and cannot be employed in a case where the shaft member having the spherical portion is desired to be reused. In addition, assemblability is not considered in the structure described in the literatures, and it is demanded to improve productivity or the assemblability and disassemblability for reuse. Furthermore, regarding the productivity, a specific method of integrally forming the bearing member main body by the structure of the disclosed bearing member main body, is not described.</p>', '<p id=""p-0019"" num=""0020"">In addition, in the structure of the coupling (shaft member) described in PTL 2, a direction or a range of swing is limited, and desired swing is not achieved. Accordingly, the phase of the photoreceptor drum when attaching and detaching the process cartridge to and from the apparatus main body is limited, and for example, there is a possibility that the process cartridge may not be able to be detached when the image forming apparatus is stopped due to paper jamming or the like, and there is also a situation where workability is significantly degraded.</p>', '<p id=""p-0020"" num=""0021"">Here, in consideration of the above-described problems, an object of the present invention is to provide an end member which operates more smoothly, is unlikely to be influenced by non-uniformity in the quality of the shaft member, and has excellent assemblability, disassemblability and productivity, and with which transmission of the rotating force which is the same as that in the related art, and attachment to and detachment from the apparatus main body are possible. In addition, an object of the present invention is to provide a bearing member, a photoreceptor drum unit, a developing roller unit, and a process cartridge.</p>']"
111,US10203650B2,Powder container and image forming apparatus,utility,"['<p id=""p-0007"" num=""0006"">The cylindrical toner container is in an arbitrary posture in the rotation direction when an operator inserts the toner container in the main body of the image forming apparatus.</p>', '<p id=""p-0008"" num=""0007"">The toner container described in PTL 1 includes a protrusion serving as an identifier shape portion on the front end surface. The protrusion is arranged such that a distance from the center of the front end surface in the radial direction varies depending on the type of the toner container. On a rotary member serving as a drive output unit of the image forming apparatus, a number of recesses serving as main-body identifier shape portions of the apparatus are provided on the same circumference centered at a point that faces the center of the front end surface when the toner container is set.</p>', '<p id=""p-0009"" num=""0008"">In the configuration described in PTL 1, if the distance of the protrusion of the toner container from the center and the distances of the recesses of the main body of the image forming apparatus from the center in the radial direction match each other, the protrusion can interlock with any of the recesses regardless of the posture of the toner container in the rotation direction. In contrast, if the distance of the protrusion of the toner container from the center and the distances of the recesses of the main body of the image forming apparatus from the center in the radial direction do not match each other, the protrusion cannot interlock with any of the recesses. Therefore, the toner container cannot be inserted to the rear end of the main body of the image forming apparatus, and an operator can determine erroneous setting at the time of setting.</p>', '<p id=""p-0010"" num=""0009"">In the toner container described in PTL 1, identifier shape portions with protrusions at different positions on a straight line in the radial direction function as identifiers for different types of toner containers. In the toner container, it is possible to provide a certain number of the identifier shape portions in accordance with the number of the protrusions that can be arranged at different distances from the center of the front end surface in the radial direction.</p>', '<p id=""p-0011"" num=""0010"">However, in the toner container described in PTL 1, it is only possible to provide the same number of types of the identifier shape portions as the number of the protrusions that can be arranged at different distances from the center of the front end surface of the toner container in the radial direction. Therefore, the types of the identifier shape portion are limited, and the types of the toner containers that can be shared except for the identifier shape portions are limited. Consequently, it is difficult to adequately reduce cost for the toner replenishing device and the toner container.</p>', '<p id=""p-0012"" num=""0011"">The present invention has been conceived in view of the above circumstances, and there is a need for a powder container capable of using differences in positions in a direction different from the radial direction as differences in identifier shape portions, and an image forming apparatus including the powder container.</p>']"
112,US10203681B2,Sequence-program-creation supporting apparatus,utility,"['<p id=""p-0012"" num=""0011"">Conventionally, when control data of a dedicated command is set, an operator who creates a sequence program needs to manually create a program for storing setting values into devices of a programmable logic controller. When an unskilled operator creates a sequence program, there is a problem in that the creation takes time because of errors of setting values and/or errors of a program in which such setting is omitted.</p>', '<p id=""p-0013"" num=""0012"">Devices in which control data is stored are desirably not to be used in uses other than the control data storage. It is necessary to clearly indicate that the devices are for the control data storage. As means for clearly indicating the use of the devices, there is a method of adding a device comment (allocating a character string to each of the devices). However, there is a problem in that it takes time to manually add a comment to each of the devices.</p>', '<p id=""p-0014"" num=""0013"">The invention disclosed in Patent Literature 1 does not display all usable commands corresponding to a unit. Therefore, when an un-extracted command word is input, creation of a program is not supported. The invention disclosed in Patent Literature 2 does not disclose anything about automatically inputting comments (device comments) input to a sequence program together with devices. In the invention disclosed in Patent Literature 3, because an operator himself/herself inputs commands and memory addresses for designating devices, it is likely that an error occurs in setting. The invention disclosed in Patent Literature 4 does not disclose anything about acquiring configuration information of extension units and displaying a list of command words corresponding to relevant extension units.</p>', '<p id=""p-0015"" num=""0014"">The present invention has been devised in view of the above and it is an object of the present invention to obtain a sequence-program-creation supporting apparatus that facilitates operation of a device that stores a dedicated command described in a sequence program and control data of the dedicated command.</p>']"
